id_str,created_at,text
765566442892853248,2016-08-16 15:10:38,"RT @GitHubEducation: 👋 Teachers! Before next semester begins, join the new GitHub Education Community: https://t.co/5xGIBqdjOL https://t.co…"
765280205480923137,2016-08-15 20:13:13,Artist and actor COMMON is headlining GitHub Universe’s Big Bang—a concert benefitting @BlackGirlsCode: https://t.co/B3WOLaZiyk
765259651772448769,2016-08-15 18:51:33,Change the base branch of a Pull Request: https://t.co/q7qeRr6nLQ
764164516078874625,2016-08-12 18:19:52,Join us in sunny Tampa Bay for a Patchwork August 30: https://t.co/mHZSw0ZnLK
763876553776177152,2016-08-11 23:15:37,GitHub Universe kicks off next month! You can attend for free on one of three different kinds of scholarships: https://t.co/tGNp8kjbsE
763094414856032256,2016-08-09 19:27:40,Have you overcome a challenge in an open source project? Tell your story at GitHub Universe: https://t.co/P7nmavUQjT https://t.co/3HurxV9pYs
763065830510690304,2016-08-09 17:34:05,RT @inboxbygmail: Evolving the inbox to save you time – now w/ organized @Trello and @GitHub project updates. https://t.co/fCJf4lXSCR https…
762802017991401472,2016-08-09 00:05:47,RT @electronjs: Check out the second Electron Internals post: Using Node as a Library https://t.co/aGFzTQkXjO https://t.co/MuOsk38P79
762767544780414978,2016-08-08 21:48:48,RT @daviesf1: Really proud to announce Mashape's integration with GitHub! https://t.co/rF8afn3C4I
762740230931648513,2016-08-08 20:00:16,Search wiki pages within a repository or across GitHub: https://t.co/WAuYGhMV5o https://t.co/n0nO8k0xsw
761630691939549185,2016-08-05 18:31:22,"Hey Dallas, Patchwork is coming to your neighborhood Aug 30: https://t.co/rVEdsjgIIb"
761612888221978625,2016-08-05 17:20:37,Use the code GIT-YOUR-SALE-ON-16 for 20% off GitHub apparel. Sale ends 8/8/16 at 12AM PDT. https://t.co/jtGJ4D5E8r https://t.co/kJ9b8UpxIL
761295804531212288,2016-08-04 20:20:38,"If you’d like to add professional workshops to your @githubuniverse agenda, see what our trainers have in store: https://t.co/5BHCUrVPEE"
760916329998143488,2016-08-03 19:12:44,"Our latest release includes GPG signature verification, new API previews, and more ways to fine-tune your workflow. https://t.co/QLfIBAeitr"
760544947707621376,2016-08-02 18:37:00,Goodbyes can be hard. Invite team members back to your organization with their settings intact. https://t.co/FRtowF02GH
760235826416529408,2016-08-01 22:08:40,RT @electronjs: Check out the first in a series by @zcbenz on Electron's internals: Message Loop Integration https://t.co/S0XtGPvhJC https:…
760198164741709824,2016-08-01 19:39:00,Introducing gh-ost: our online schema migration tool for MySQL by @ShlomiNoach https://t.co/BbpelcRkrq https://t.co/yRK3v8vhc1
759859024514785280,2016-07-31 21:11:23,Today's the last day you can pick up an early-bird ticket or submit a proposal for @githubuniverse:  https://t.co/BrWApFzihM
759599961944186880,2016-07-31 04:01:58,RT @githubuniverse: Early bird tickets are going fast! You only have a little more time to get yours: https://t.co/Y7TeNYpAID
758736599551139841,2016-07-28 18:51:16,The countdown to @githubuniverse continues—only four days left to submit a proposal or get an early-bird ticket: https://t.co/GAOFf89yJ8
758045389886926848,2016-07-26 21:04:39,You can now invite members to your organization with email invitations—even if they don't have a GitHub account yet: https://t.co/Nfj1LAQztY
758019378403094528,2016-07-26 19:21:17,Early-bird ticket sales for GitHub Universe end this Sunday. Jet over to https://t.co/H31sg6SOIT to pick up yours.
757965440433975302,2016-07-26 15:46:57,We're teaming up with Code for Philly for a Patchwork on Aug 2: https://t.co/mUgyVK3Hk4
755828748084125698,2016-07-20 18:16:30,There's still time to get an early bird ticket to Universe! Register for the conference + workshops before July 31: https://t.co/mj4BjAmecQ
753736484360814592,2016-07-14 23:42:36,RT @GitHubEng: SYN Flood Mitigation with synsanity by @theojulienne https://t.co/IaBIwWjh6Z
753294285907210240,2016-07-13 18:25:27,"We’re now accepting proposals for GitHub Universe talks. Submit yours before July 31, 2016: https://t.co/HTx7WiYY0R"
752918053919330305,2016-07-12 17:30:27,"Patchwork Seattle happens July 21. If you're in town, we'd love to see you there. https://t.co/NDcmn21pmK"
752624971617177600,2016-07-11 22:05:50,RT @aha_io: Just Launched! — Aha! Now Integrated with @github Enterprise https://t.co/TyxNzUX2Gr #prodmgmt #github https://t.co/Bpg1V0gNsz
751465777748856832,2016-07-08 17:19:37,"Universe is back, are you ready for launch? Get details, submit to the CFP, or grab an early bird ticket at https://t.co/H31sg6SOIT 🚀"
750752663831056384,2016-07-06 18:05:58,"GitHub Universe is back and bigger than ever. See all the details, get early bird tickets, and check out the CFP https://t.co/qExyrtQQpp"
750460457295552512,2016-07-05 22:44:50,Reorder Issues within a Milestone to indicate priority using drag-and-drop. https://t.co/bM4YjsYUMf https://t.co/Z7WRG2er46
748882562123239424,2016-07-01 14:14:51,A special Patchwork PRIDE edition will be in Amsterdam on 5 August. Join us! https://t.co/VfuGlmaSKR
748438944254132224,2016-06-30 08:52:04,More context for your email notifications—now you can include your own GitHub activity in your email updates: https://t.co/nZ0csTwhoC
748316455821676546,2016-06-30 00:45:20,"RT @codeconf: That's a wrap! Thanks to all of our amazing speakers, sponsors and community partners for a great event. https://t.co/Ju1jJjk…"
748262564275044352,2016-06-29 21:11:12,RT @changelog: BIG show this week! #209: @GitHub and @GoogleCloud on Public Datasets and #BigQuery https://t.co/vr4Q0ScKeQ #bigdata https:/…
748247842859454465,2016-06-29 20:12:42,Announcing our biggest release of open source data ever: https://t.co/9mqbbRZCji
748201914274222080,2016-06-29 17:10:11,"The CodeConf live stream is back on https://t.co/TgLMYClIT6. Today you can check out talks from @nayafia, @kerrizor, and @pleia2."
747855819417346048,2016-06-28 18:14:56,We've released our 2015 Transparency Report—a breakdown of user-related legal requests we received last year: https://t.co/Z9zbmorMF8
747827921797058564,2016-06-28 16:24:05,Talks are starting soon at #CodeConf LA. Head to https://t.co/TgLMYClIT6 at 10AM PST to join the live stream and watch them all from home.
747592902759452672,2016-06-28 00:50:12,The #codeconf live stream starts tomorrow at 10AM PST. Check out the full schedule to decide when to tune in: https://t.co/9mynYtiwGK
746505703825809408,2016-06-25 00:50:03,The GitHub Campus Experts program trains students around the world in community leadership and software development: https://t.co/ucm37aSzkZ
746482170697416704,2016-06-24 23:16:33,These organizations are making the world (and Codeconf LA) a better place: https://t.co/BRMjNHs3Ah
