id_str,created_at,text
830177962049708033,2017-02-10 22:13:44,Vue.js is a community-funded JavaScript framework that just reached 2M downloads. @youyuxi shares his story.… https://t.co/Ed66eG7zJp
830110197402071040,2017-02-10 17:44:28,"If you missed #gitmerge, don't worry. We'll share session recordings soon. In the meantime, here's a short recap. https://t.co/vCAvpvtpIU"
829860503040057345,2017-02-10 01:12:16,"RT @electronjs: We're starting a ""Project of the Week"" blog series. First up is Kap, an open-source screen recording app.https://t.co/Sbd…"
829406666009370624,2017-02-08 19:08:53,".@kytrinyx is the creator of Exercism, an open source platform for learning programming languages. Here's her story. https://t.co/yLhMD1zA2I"
829371041424166913,2017-02-08 16:47:19,"We're hosting a webcast on the basics of using GitHub at work, like issues and mentions. Join us on 2/13!… https://t.co/IPLNPsQqcL"
829146465859571712,2017-02-08 01:54:56,"We're updating our Terms of Service soon, and we'd like your feedback! Please look over the new Terms by Feb 21. https://t.co/t5rHQX5lbN"
829043390884884480,2017-02-07 19:05:21,"Announcing Inform and Act, our initiative to support communities most impacted by executive orders and actions. https://t.co/Q0al7asFlz"
829021239872086016,2017-02-07 17:37:20,"#githubsatellite is headed to London, May 22-23! In the meantime, pick up an early bird ticket or submit a talk.… https://t.co/G49lFaJlzq"
828666140075323398,2017-02-06 18:06:18,Thinking of applying to GSoC as an organization? We have a few ideas on how to run a successful mentorship project.… https://t.co/KQA8EcNZvN
827637972434505729,2017-02-03 22:00:44,We're hosting a webcast on a few basics of using GitHub at work 💼. Join us on 2/13. https://t.co/3jXtVBoJD6
827448361464668160,2017-02-03 09:27:17,"Good morning from Brussels! If you're tuning in from home, #gitmerge is live on https://t.co/vcYN2kgsa5. https://t.co/fL8WmEWuuf"
827303166894956544,2017-02-02 23:50:20,How are teachers using GitHub? @GitHubEducation shares how educators are changing the way we learn to code. https://t.co/W36D76O9hm
827070852621430784,2017-02-02 08:27:12,"It's time for #gitmerge! Workshops are underway, but you can tune into the livestream tomorrow, Feb 3, at 10:00 CET… https://t.co/siwiiksdjP"
826937536220061696,2017-02-01 23:37:27,See your project's history with the Activity view. https://t.co/xcAPmLlzHP https://t.co/YmbflSEoAn
826543147932987392,2017-01-31 21:30:17,A new way to discover and connect GitHub repositories. https://t.co/JVJCj8JzeV
826206514167681025,2017-01-30 23:12:37,"There's a new way to recover your GitHub account in 2FA lockout scenarios, available January 31.… https://t.co/F2ldqIUJq0"
825594478173904900,2017-01-29 06:40:37,"RT @defunkt: This ban is wrong. It goes against GitHub's values and it goes against America's values. We make progress together, not apart."
823936923194433536,2017-01-24 16:54:05,RT @electronjs: New to Electron development? We put together some simple sample apps to help you get started.https://t.co/CNBr1qgABc http…
823624575531421696,2017-01-23 20:12:55,Filter pull requests by review status to see where you're needed most. https://t.co/Zve4PunayR
823590567758229504,2017-01-23 17:57:47,Want to help us improve our content security policy? Here's a summary of our CSP journey so far from @patricktoomey… https://t.co/mB1176YtWo
822498634780446721,2017-01-20 17:38:50,"Review code and make changes to pull requests, all within Visual Studio. https://t.co/TUM3Dldr7B"
822189899784667136,2017-01-19 21:12:02,"Data from millions of open source repositories are ready for you to explore, from geography to emoji 📊. Learn how. https://t.co/clYyo9QcQr"
822135692180344832,2017-01-19 17:36:38,There's still time to submit a #gitmerge lightning talk. The extended deadline is January 24.… https://t.co/XGxbSqFj4H
821833921859973120,2017-01-18 21:37:30,Navigating file history is now even faster. Manipulate space and time with improved blame view.… https://t.co/M10Pa49mqH
821405036961902593,2017-01-17 17:13:16,RT @GitHubEducation: Flatiron School joins the Student Developer Pack offering their Community-Powered Bootcamp:https://t.co/8RIVt2tGNL h…
820064662737670144,2017-01-14 00:27:06,Our Bug Bounty just turned three. Let's celebrate with a new target and payout bonuses. https://t.co/wdomHq5hil
819677523222986752,2017-01-12 22:48:45,In the Bay Area? Stop by @ComputerHistory Museum for a conversation with CEO @defunkt on GitHub and our community. https://t.co/J8ebOcCjrl
819590031429931009,2017-01-12 17:01:05,"You can attend #gitmerge on scholarship. If you're from an underrepresented group in tech, here's how to apply. https://t.co/79J3HmIRr9"
818932762908434432,2017-01-10 21:29:20,RT @GitHubEng: Moving persistent data out of Redis by @bryanaknight and @mikelodeon https://t.co/MWUk8a7hfo
818548407987945473,2017-01-09 20:02:03,"The GitHub Bug Bounty is turning three, which makes it about 95% potty trained. Let's celebrate with payout bonuses! https://t.co/FbMRcNcjDd"
817432332919402496,2017-01-06 18:07:09,Want to share how you're using Git? Give a lightning talk at #gitmerge. Submissions are open through January 13.… https://t.co/lqLU4H5zdU
817173822302367744,2017-01-06 00:59:56,RT @GitHubAPI: Preview the Commit Search API https://t.co/elJ5aZAPSc
816796667290583040,2017-01-05 00:01:15,Who depends on your Ruby project? Explore the community connected to it with the new dependents graph. https://t.co/U7VwzsAisA
816428386356580353,2017-01-03 23:37:50,Find commit messages within your project or across all of GitHub. https://t.co/oDiVquJoc8
816340063051096064,2017-01-03 17:46:52,"RT @GitHubEducation: Thank you, teachers! This semester you requested GitHub materials to teach almost 20-thousand students worldwide: http…"
812020320508973056,2016-12-22 19:41:45,RT @GitHubEducation: Check out the winning #MyOctocat drawing contest entries from this semester's student hackathons https://t.co/AbQuNfuv…
811272484024709120,2016-12-20 18:10:07,Mark your calendars! Early bird tickets for @githubuniverse 2017 are now on sale. https://t.co/EpFkzdfAR5
810972817160368128,2016-12-19 22:19:21,"Just in time for @linuxconfau: join us for a Patchwork in Hobart, Tasmania. https://t.co/xU4kBmIyH2"
809496894263046144,2016-12-15 20:34:33,Style your GitHub Pages site in just a few clicks with the new Jekyll theme chooser. https://t.co/DCOxxGu0YV
809466821686411264,2016-12-15 18:35:04,"From taming unwieldy repositories to handling the meanest use cases, here's what you'll learn at #gitmerge. https://t.co/aDsgrH5ToG"
809145114652090368,2016-12-14 21:16:43,Follow Snyk's journey from CLI tool to full-fledged GitHub integration: https://t.co/G87i3nehnn
808780816905998336,2016-12-13 21:09:07,"We're now maintaining orchestrator, an open source MySQL cluster management solution. See how it works.… https://t.co/0n50d8qirZ"
808698454192984064,2016-12-13 15:41:51,You submitted some amazing games for the Game Off - thank you! Here are are some of our favorites… https://t.co/ZjDyJI6ME6
808466794813878272,2016-12-13 00:21:19,"Congrats to Hyper, the terminal built by nearly 100 contributors using web technologies, for hitting version 1.0.0 🎉 https://t.co/sFkkDruiVi"
808431760677605377,2016-12-12 22:02:06,Resolve simple merge conflicts directly from your pull requests! https://t.co/DJWIFVQvTX https://t.co/tLonPkMB3j
807389330528288768,2016-12-10 00:59:51,Publishing with GitHub Pages is now even simpler. Just three steps and you've got yourself a website. https://t.co/hEwuD3aSoE
806631759739658240,2016-12-07 22:49:32,Make sure the right people see your work. You can now request reviews directly from your pull requests.… https://t.co/rCW4w7dgEt
806589055496400897,2016-12-07 19:59:51,Crawl a dungeon or two during #HourofCode with @CodeCombat—an open source game that teaches kids how to code.… https://t.co/p8h6Xt0BEH
806569784556912640,2016-12-07 18:43:16,How @GitHubEng improved performance of our main diff pages https://t.co/r1TGPRqZQx
804405155122835457,2016-12-01 19:21:48,"RT @GitHubEng: GLB part 2: HAProxy zero-downtime, zero-delay reloads with multibinder by @williamsjoe and @theojulienne https://t.co/7ncvNV…"
804399119024451584,2016-12-01 18:57:49,"To help everyone build better software, we joined the White House’s Tech Inclusion Pledge. You can pledge, too: https://t.co/emtBYrtJpM"
804020078102663169,2016-11-30 17:51:39,RT @GitHubEducation: Now available for free download: the GitHub for Robotics comic book for your phone or tablet https://t.co/oF5s4bOyL9 h…
803999466214879232,2016-11-30 16:29:44,Tickets to #gitmerge include add-on workshops and a day of talks. Proceeds go to the Software Freedom @Conservancy. https://t.co/sOTFF9VRGx
803872412777385984,2016-11-30 08:04:53,Git LFS checkout times are now up to 80x faster with support for the new filter-process mechanism in Git 2.11… https://t.co/ELDf0HqOUB
803712222396444672,2016-11-29 21:28:20,"Abbreviated SHA-1 names, performance optimizations, and advanced filter processes—Git 2.11 is now available https://t.co/Y7Xhu98QK0"
803698481311387648,2016-11-29 20:33:44,RT @zeithq: Deploying Git repositories just got a lot easier! ✌️ https://t.co/aphEZISaJB https://t.co/CxoGnBhapc
803684220417679360,2016-11-29 19:37:04,"Mention GitHub in your @mavenyouth donation today, and we'll match up to $5K in total. https://t.co/4SVkDJefSM https://t.co/GNaN0s6tvT"
803301309969563648,2016-11-28 18:15:31,"Now through Tuesday, get free shipping on orders over $30 and 30% off everything in the GitHub Shop. https://t.co/sK0gMvw92S"
802660460248109060,2016-11-26 23:49:01,"This Monday, you'll find something snuggly in the GitHub Shop. https://t.co/xQsVQ4wVeH https://t.co/prvEdBoq6K"
801742222181928960,2016-11-24 11:00:16,"Enrolled in a German university? Check out @informatiCup, a machine learning challenge on Github data. https://t.co/jnqH2o0Zgr"
801091777578995712,2016-11-22 15:55:37,A gift to you this holiday season: more time to submit your #gitmerge proposal. The extended deadline is 11/27.… https://t.co/r4shKhZTbb
799346578179768324,2016-11-17 20:20:50,"Version 2.1 includes support for Visual Studio 2017 RC, a new Start Page experience, and faster startup time. https://t.co/Czvltk92ik"
799302255237210118,2016-11-17 17:24:42,"RT @digitalocean: Thank you to everyone involved in #hacktoberfest 2016!* 📈 92,569 PRs* 📁 29,287 repos* 👕 10,227 t-shirtshttps://t.co…"
798961148708065280,2016-11-16 18:49:16,Color your cares away with the GitHub Activity Book—now available in the GitHub Shop. https://t.co/EER4pG8Dpo
798623867849715712,2016-11-15 20:29:02,"Students can get a year of free access to @GitKraken's GUI for Windows, Mac, and Linux. https://t.co/xBJttumTEJ"
798586469531193348,2016-11-15 18:00:26,Want to add some sound effects to your #ggo16 game? Make your own with https://t.co/80YmAyJxUg https://t.co/kz6e5eEY9n
797134513444888577,2016-11-11 17:50:52,"Through education and policy, @operation_code prepares veterans for jobs in the software industry.… https://t.co/OhSMkA8P7r"
796489455167225857,2016-11-09 23:07:38,"2.8 includes code review and project management tools, along with a new way for you to produce and share data. https://t.co/WewISWL5Oq"
795658059611865088,2016-11-07 16:03:58,The call for #gitmerge2017 proposals is now open. Submit yours by November 21st: https://t.co/R5n94GyTeh https://t.co/erEBqNcKHX
794941124062351362,2016-11-05 16:35:07,Create retro-style sprites for your #ggo16 game or just some sweet pixel art with @piskelapp:… https://t.co/d0kQgEfAFR
794586531684057088,2016-11-04 17:06:06,"Level up your game development skills with this list of open source games, engines, libraries and more:… https://t.co/zsx6o8UUac"
794227392172605440,2016-11-03 17:19:00,"Patchwork is headed to Austin, TX. Stop by to learn or mentor others at this beginner-friendly workshop. https://t.co/BU0mQe8sui"
793880025174990848,2016-11-02 18:18:42,What's new in GitHub Pages with Jekyll 3.3 https://t.co/6VYD7DzCcs
793552483356291073,2016-11-01 20:37:10,And the Game Off theme is... https://t.co/8Y0cwQlhPx
793500367027838976,2016-11-01 17:10:04,Git Merge 2017 is coming to Brussels. All ticket proceeds are donated to the Software Freedom Conservancy.  https://t.co/gZKjHp7tjP
793231141201477632,2016-10-31 23:20:16,"We're talking about ways to work transparently on GitHub Enterprise, even with security standards. Join in on 11/16… https://t.co/DpFGOZCFS1"
793154845993730050,2016-10-31 18:17:06,"Just one day left in #hacktoberfest. If you've made four public PRs this month, there's still time to claim a shirt. https://t.co/ubIpfdSlXg"
792088190307987456,2016-10-28 19:38:35,An update and postmortem on a recent incident https://t.co/clwYjBlJS8
791759883800571905,2016-10-27 21:54:01,"Now organizations can pin repositories, too. Head to your organization's profile page to try it out. https://t.co/kagazllYOV"
791739350094606336,2016-10-27 20:32:25,Organization-wide project boards help you plan work across repositories: https://t.co/4tWiXAMWme
791423126861123588,2016-10-26 23:35:52,"Meet @nahi, developer, Ruby core contributor, and the focus of our latest developer profile: https://t.co/Cc6DZbQqHY"
791324705412251649,2016-10-26 17:04:46,GitHub icons in decal form—pick up an Octicon Sticker Pack today. https://t.co/v4H00r1Rm1
790653360387026944,2016-10-24 20:37:05,Get ready player one. The theme for our game jam will be announced in one week: https://t.co/RVVEYSQDcm #ggo16
790621192621285377,2016-10-24 18:29:16,"The top open source launches on GitHub since 2015, ranked by number of stars gained in their first week: https://t.co/49ky78Ddck"
790591218128486400,2016-10-24 16:30:09,Interested in GitHub Enterprise? We’re talking about staying transparent under security standards. Join in on 11/16… https://t.co/qlbKXzBN7W
788531997601832960,2016-10-19 00:07:33,Help us become a more welcoming community — Now accepting feedback on our proposed Community Guidelines https://t.co/C1Us6wSXsO
788526244962983936,2016-10-18 23:44:41,Love data visualizations? You can visualize cohorts with @keen_io's new open source tool. https://t.co/mMAGGTJPAN https://t.co/7IUZQ3Kmtf
788107591318634496,2016-10-17 20:01:06,Just two weeks left in #hacktoberfest. Find out how to get help with or contribute to open source projects: https://t.co/EXIQqnJIgl
788083980193058816,2016-10-17 18:27:17,Using GitHub at school? Ask your teacher to request a swag bag: https://t.co/1TqIEqEViL https://t.co/S1AziPGLpP
787039273451126784,2016-10-14 21:15:59,Break down organizational siloes &amp; increase collaboration across teams in the Enterprise by introducing InnerSource: https://t.co/h6q437icFR
786597318401351680,2016-10-13 15:59:49,Get testing with @taplytics in the Student Developer Pack: https://t.co/A3pWTFH9HH
786291970989850624,2016-10-12 19:46:29,Congratulations to @yarnpkg on hitting 10k stars since launching yesterday. https://t.co/JsE6IZm8kV
786272860209897472,2016-10-12 18:30:32,You can now dismiss a review on a Pull Request! https://t.co/prc7sXnrxb
785930476523520000,2016-10-11 19:50:02,"If you want to help the Git community understand your needs, you can still fill out the annual Git survey: https://t.co/LyWaDr2iu1"
784436559319674880,2016-10-07 16:53:44,"Game Off, our month-long game jam, returns next month: https://t.co/WI6osBFIb1 https://t.co/IDlA3dEzR8"
783683225759707137,2016-10-05 15:00:15,"Five individuals involved in open source tell a short story about a challenge, and how they over came it. https://t.co/d0SoeblfZw"
782987178272034816,2016-10-03 16:54:25,Hear @dlschafer and @kdaigle explain how GraphQL works and what changes we're making to support a new GraphQL API. https://t.co/JzY80AMLkk
782867826658902016,2016-10-03 09:00:09,"Last week @LeafletJS—a library for mobile-friendly, interactive maps—released their 1.0 version and hit 15K stars.… https://t.co/yyDX0vsuSe"
782626482673881088,2016-10-02 17:01:08,How does @SlackHQ build their native app with the latest and greatest web technologies? https://t.co/bpC3iUANxR
781973164922433536,2016-09-30 21:45:05,RT @katecrawford: Useful curated list of the most cited machine learning papers since 2010. https://t.co/Bhknqc6n1a
781942970958352384,2016-09-30 19:45:06,"Hacktoberfest kicks off this weekend. Get a little help on your open source project, or contribute to someone else'… https://t.co/Apk2vcDU7H"
781877100051566592,2016-09-30 15:23:21,.@js13kgames participants made the most of 13 kilobytes. Try their games out on your next coffee break: https://t.co/6hPY7KF73B
781780679180836864,2016-09-30 09:00:13,How a small team quietly started @GOVUK—an effort to reimagine government as digital by default: https://t.co/ATrNHGk52Q
781629675189768193,2016-09-29 23:00:11,Keynotes and talks from #githubuniverse featured speakers are ready for you to watch from home. https://t.co/ILiQBjezkL
780873354190266368,2016-09-27 20:54:50,RT @electronjs: Electron's API Docs are now available as structured data.https://t.co/w7XPG1i0jmnpm i -g trymodule &amp;&amp; trymodule electro…
780810777259151362,2016-09-27 16:46:10,Celebrate open source this October for #hacktoberfest. Four pull requests earn you a limited-edition t-shirt: https://t.co/8mzCBYRjVG
780414798169247744,2016-09-26 14:32:41,Introducing our newest pull request merge option: rebase https://t.co/gkA4dzuh0h
778701320286932992,2016-09-21 21:03:56,A quick new way to find out if a project is using an open source license: https://t.co/uo0OIH7cQH
778678818441531393,2016-09-21 19:34:32,Cheers to the Homebrew community on today’s 1.0.0 release: https://t.co/TcbbLrCddL 🍻
778352899092942848,2016-09-20 21:59:26,RT @githubuniverse: Keynote and general session recordings are ready for you to watch from home. More details in our mission report: https:…
778298329058775045,2016-09-20 18:22:36,Learn to code for good alongside a friendly community with @FreeCodeCamp's open source curriculum.… https://t.co/0XrjTFTEfZ
776880501462138880,2016-09-16 20:28:39,RT @HospitalRun: Join us next Fri or Sat at @github HQ for the @HospitalRun hackathon. Sign up https://t.co/4SGa1PJghV or learn more https:…
776450685764243456,2016-09-15 16:00:43,"Day two of @githubuniverse starts soon. You can see today's schedule, and watch each session live: https://t.co/h91U9s9n8u"
776195359311704064,2016-09-14 23:06:09,RT @GitHubEng: The GitHub GraphQL API https://t.co/1EFnZGkRp8
776171191849586688,2016-09-14 21:30:07,"A tribute to how you—developers, artists, activists, scientists—build software by GitHub Studios. https://t.co/xFaEAohMGa"
776123063712616448,2016-09-14 18:18:52,"Code review, project management, and new profiles—all available today: https://t.co/DnZ9dlOmIx"
776119998217490433,2016-09-14 18:06:41,"Congrats to 800,000 of you on your first pull request this year. For more highlights from 2016, tour the Octoverse: https://t.co/GrJDHJM6ZD"
776100720701497344,2016-09-14 16:50:05,GitHub Universe is starting soon—tune into the keynote as we announce some of the biggest changes to GitHub yet. https://t.co/DnZ9dlwLQZ
776088385970642944,2016-09-14 16:01:04,"Watch all GitHub Universe sessions as they happen, September 14 and 15: https://t.co/Cmv2o6QaTy"
775771882259787776,2016-09-13 19:03:24,GitHub Universe kicks off tomorrow in San Francisco—and in your browser. The live stream starts at 10AM PST: https://t.co/Cmv2o77LL6
775727589822390272,2016-09-13 16:07:24,See metrics from all of your apps with @datadoghq—now in the Student Developer Pack: https://t.co/aznd5S0wh0
775450144686747648,2016-09-12 21:44:56,"RT @githubuniverse: Ask questions, watch a demo, or get cozy in a lounge. Here’s what you can do between sessions at GitHub Universe: https…"
773993223781875712,2016-09-08 21:15:39,"Sign up for @githubuniverse workshops on Git, APIs, CI/CD, and more—or schedule some time with our trainers. https://t.co/zih99BxRFY"
773933309516615680,2016-09-08 17:17:34,Join us at @githubuniverse as we announce new features and community developments. https://t.co/7OCK5Oe8g8 https://t.co/JS4xkSNWUC
773919028788105218,2016-09-08 16:20:49,"New school year, new projects—@transifex helps you localize your software, so your next app is ready for the world. https://t.co/wuokxezyON"
773901138387009537,2016-09-08 15:09:44,"Intro to GitHub is a free, online course in GitHub basics. Learn at your own pace with help from our trainers. https://t.co/dE6QjWxGKZ"
773630498966863872,2016-09-07 21:14:18,Spend your next summer break as a GitHub intern. You'll make an impact and learn new skills from GitHubbers. https://t.co/KxNPEpHUNZ
773583050840109060,2016-09-07 18:05:46,Improving collaboration with forks https://t.co/OciZghAYGe
773569168452964352,2016-09-07 17:10:36,"Mentorship creates vibrant, accessible communities. Hear from @pwnela at @githubuniverse. https://t.co/CMUJ6MRy7O https://t.co/R2rXhNvTSo"
773300731646398464,2016-09-06 23:23:56,Meet a few of our Community Partners—organizations bringing more voices to GitHub Universe. https://t.co/4duDoJxyF3 https://t.co/SZhSHyODZK
771897603252375552,2016-09-03 02:28:24,A new version of Git has arrived with progress reports for pushes and improvements to GPG signature verification: https://t.co/Sl9l2biVBC
771818522913546240,2016-09-02 21:14:10,How can we create a truly multilingual open source community? Hear from @chimeracoder: https://t.co/5OAo9H2vzu https://t.co/KxY8tYb8cs
771428174445944833,2016-09-01 19:23:03,"Meet Olivia—a @BlackGirlsCode alum who makes games, mentors others, and thinks big about her future. https://t.co/r3OvKFhE09"
771086603158589440,2016-08-31 20:45:46,"Slack, Electron, 99% Invisible, and more featured speakers and panels are now part of the @githubuniverse lineup. https://t.co/JugtJgtotO"
770736204157378562,2016-08-30 21:33:25,"RT @githubuniverse: If you're headed to GitHub Universe, skip the registration lines and pick up your badge at a pre-launch social: https:/…"
770676250264244224,2016-08-30 17:35:11,"Compose with colorful, web-based samples and synths with @blokdust—or see how it works. https://t.co/Xgb31viGMV https://t.co/373Out9c9U"
770371068942921728,2016-08-29 21:22:30,"Thank you to our 2016 sponsors for making @githubuniverse a better, brighter place with art, eats, and activities. https://t.co/tzm54KQnVf"
770349837795545088,2016-08-29 19:58:08,We've updated our Privacy Statement. Learn more about what's new: https://t.co/aHJ7XGMnCk
769980166898589696,2016-08-28 19:29:11,Find out how a national laboratory uses open source software at @githubuniverse. https://t.co/xeDbwAZtjA https://t.co/V3alyhutHC
769274567218954240,2016-08-26 20:45:23,"“We prize creativity down to the operations team."" Take a peek into how a few of MailChimp's teams work together: https://t.co/rAcLQKHMFY"
769246152801660928,2016-08-26 18:52:29,This @NASAAmes project supports data analysis and gives you a glimpse into mission control. https://t.co/cp2gYHqwK6 https://t.co/MKuFkNgPem
769189721805295616,2016-08-26 15:08:15,"We have a few tickets left for our Patchworks in Boulder, Dallas, and Tampa Bay next week. Join us! https://t.co/IBCmqyWQSS"
768893439702216704,2016-08-25 19:30:56,Hear from @kytrinyx on the challenges and triumphs of project maintenance at @githubuniverse https://t.co/xeDbwAHRV0 https://t.co/lXg9QX3GzQ
768220487121907712,2016-08-23 22:56:51,"RT @GitHubEducation: Thinkful joins the Student Developer Pack, providing free access to one-on-one mentorship in web development https://t…"
768183734164074496,2016-08-23 20:30:49,GitHub Pages has been upgraded to Jekyll 3.2 for Gem-based themes and more than 100 other improvements.  https://t.co/aAqVvlBsQW
768171484858621952,2016-08-23 19:42:08,RT @GitHubEducation: Discussing open source lesson plans with teachers on the GitHub Education Community: https://t.co/jqTyanP3S1 https://t…
768145959603757058,2016-08-23 18:00:42,RT @changelog: On #216 @zeke talks to us about @GitHub’s @Electronjs &amp; the future of web folks making cross-platform desktop apps. https://…
767843039276470272,2016-08-22 21:57:01,RT @githubuniverse: Why attend Universe? We can think of a few good reasons: https://t.co/ta0bo8mjGF
767798430701760513,2016-08-22 18:59:45,Great documentation makes any project better. Learn how to publish yours with GitHub Pages. https://t.co/hr9FGck0b5 https://t.co/pOO0PczEJ8
767783843189272576,2016-08-22 18:01:47,RT @GitHubEducation: GitHub partners with Google igniteCS to support students providing computer science mentorship in their communities ht…
766726484174118912,2016-08-19 20:00:13,Install the latest version of the extension to create new pull requests and gists from Visual Studio. https://t.co/aeGapCLE4N
766702621595869184,2016-08-19 18:25:24,Learn to build an Atom plugin that'll help you find and use code snippets on @StackOverflow: https://t.co/MfrEjlfkKT https://t.co/BTiL5X3U5t
766042818808680448,2016-08-17 22:43:35,From code review to national security—the full lineup of @githubuniverse talks and trainings is now available. https://t.co/B4oAyUCcvi
766001005527916544,2016-08-17 19:57:25,Manage your block list from your settings page. https://t.co/DNafqhMZuH https://t.co/C349K15uW0
765985606727892992,2016-08-17 18:56:14,RT @GitHubEng: Context aware MySQL pools via HAProxy by @ShlomiNoach https://t.co/KBltXlCQwX
765972459615125505,2016-08-17 18:04:00,Select the source of your GitHub Pages site https://t.co/EMZmEllxQ8
765628314975367168,2016-08-16 19:16:29,"There's a Patchwork coming to Boulder, CO on August 31: https://t.co/XH0pNS6c8G"
765604089979731969,2016-08-16 17:40:13,"Make a software developer's day. Build an integration that makes work better, and we'll help people find it: https://t.co/Zv3uvgohzF"
