id_str,created_at,text
828959082371481600,2017-02-07 13:30:21,Focus on one or two social issues to stay involved without losing your mind: https://t.co/AL4Q4DZTJz https://t.co/pbxT0L4chm
828952479475851264,2017-02-07 13:04:06,"Here are more reasons to file your taxes early, if getting a refund and thwarting identity theft weren't enough:… https://t.co/lE5JyhDRBq"
828944928436789248,2017-02-07 12:34:06,You can now double-tap the sides of the screen on YouTube for Android to skip forward or backward:… https://t.co/Qz8qWOLSoM
828936459168145408,2017-02-07 12:00:27,"We asked, and you delivered. These are your worst life hacking failures: https://t.co/z44OjCDY97 https://t.co/5RLeqfs5io"
828915686160400384,2017-02-07 10:37:54,Put a bell on your bicycle: https://t.co/bE3pwxSGBL https://t.co/Ubbi08nq5n
828874386602078208,2017-02-07 07:53:48,Avoid foreign ATM fees when traveling abroad with these checking accounts. https://t.co/r9VAIw9vr7
828865891370749953,2017-02-07 07:20:02,"Google Maps update adds traffic, transit, and nearby location info all in a handy bar at the bottom of the app:… https://t.co/ykDK2rP8in"
828848291345481728,2017-02-07 06:10:06,Don't let Pandora put you in a box. Stick to the thumbs-down button to get a better variety of music:… https://t.co/Yn46k0ezHb
828840721885122560,2017-02-07 05:40:01,The easiest thing you can do isn't always the most pleasurable. Schedule your fun activities just like you do work:… https://t.co/w2W4cLa4ok
828833193549762560,2017-02-07 05:10:06,"Neil Cicierega, the guy behind Potter Puppet Pals, has some advice for young artists: Keep your old files.… https://t.co/NrfwCqy7B7"
828805505627856896,2017-02-07 03:20:05,"Google Maps update adds traffic, transit, and nearby location info all in a handy bar at the bottom of the app:… https://t.co/SOuWhvsowF"
828795978752913409,2017-02-07 02:42:14,Just start dating someone? Here's how you should approach Valentine's Day when you're in a new relationship:… https://t.co/tAc5F6dqVX
828787890830372864,2017-02-07 02:10:05,Don't let Pandora put you in a box. Stick to the thumbs-down button to get a better variety of music:… https://t.co/GFP6wWJDKY
828780350692347906,2017-02-07 01:40:08,The easiest thing you can do isn't always the most pleasurable. Schedule your fun activities just like you do work:… https://t.co/kmD8BMOtxs
828779614638108673,2017-02-07 01:37:12,The simple pleasure of wireless headphones: https://t.co/PsntkeOdUh https://t.co/EqfhKbL29r
828772781064146944,2017-02-07 01:10:03,"Neil Cicierega, the guy behind Potter Puppet Pals, has some advice for young artists: Keep your old files.… https://t.co/3F6mPvK0zp"
828770353812008960,2017-02-07 01:00:24,Today's featured bag comes to us from a mobile filmmaker: https://t.co/6rbkqcqIAk https://t.co/CYykd20g1u
828755683914940416,2017-02-07 00:02:07,Cracks around your window frame letting the cold in? Seal them with bubble wrap: https://t.co/1Gh3f2OR7d https://t.co/hVkYV6KBZC
828747876209684481,2017-02-06 23:31:05,"Google fixing AMP URLs, WhatsApp testing a feature that will let you revoke unread messages, and more in the news:… https://t.co/vS73VV3eLX"
828745111571939332,2017-02-06 23:20:06,"Google Maps update adds traffic, transit, and nearby location info all in a handy bar at the bottom of the app:… https://t.co/2codmiIFsS"
828740138364706817,2017-02-06 23:00:20,This DIY portable spray paint booth is easy to build and even easier to carry or stow away: https://t.co/IY1aCZqyjf https://t.co/EuHgaZTK9o
828732549321072640,2017-02-06 22:30:11,Planning a vacation soon? These are the most and least expensive states for short-term vacation rentals:… https://t.co/Hr3v8K5yDf
828727490243940352,2017-02-06 22:10:05,Don't let Pandora put you in a box. Stick to the thumbs-down button to get a better variety of music:… https://t.co/jPmouiS2Dj
828725229514084352,2017-02-06 22:01:06,Silence is good. Why you need less noise for work and your health: https://t.co/PaPktIoFmb https://t.co/cWvyAMbGlX
828721273274523650,2017-02-06 21:45:23,This DIY baked air freshener uses up your fruit scraps and makes your home smell incredible: https://t.co/KQdwngHl5x https://t.co/8AUnhn1Uwp
828719929411117058,2017-02-06 21:40:02,The easiest thing you can do isn't always the most pleasurable. Schedule your fun activities just like you do work:… https://t.co/41K3AaX8Ce
828712405425336320,2017-02-06 21:10:08,"Neil Cicierega, the guy behind Potter Puppet Pals, has some advice for young artists: Keep your old files.… https://t.co/cVNfyHzpf3"
828709964441124864,2017-02-06 21:00:26,This little desk accessory is pretty easy to make for yourself: https://t.co/MMvfr5Icbd https://t.co/7unhe7kjuk
828704490899521536,2017-02-06 20:38:41,RT @VitalsLH: The most popular herpes test is commonly wrong. https://t.co/4ZOquH5WT0 https://t.co/vAyUgWhJk5
828703483415109632,2017-02-06 20:34:41,Lunchtime Views is curing your Monday blues with these scenes from a recent visit to Isla Mujeres:… https://t.co/g9nQLbASVi
828694822185730048,2017-02-06 20:00:16,Come ask an expert! Today we're discussing everything you need to know about life insurance: https://t.co/N6a98b2M0V https://t.co/fdhr912reG
828687244340973569,2017-02-06 19:30:09,Use the right nozzle tips on your spray cans to get perfect lines: https://t.co/j1LfkXO3Gt https://t.co/AIbirS4cVN
828684699845398528,2017-02-06 19:20:03,"Google Maps update adds traffic, transit, and nearby location info all in a handy bar at the bottom of the app:… https://t.co/KX0jjDQqhJ"
828679766182129664,2017-02-06 19:00:27,No more voicemail prevents callers from leaving a message: https://t.co/EZGfSnd3Qy https://t.co/GAR4mHRBvG
828672188043653120,2017-02-06 18:30:20,Beat jet lag by eating meals on local time before you travel: https://t.co/LKXtpcfB9z https://t.co/XPlBvf7crJ
828668701209669632,2017-02-06 18:16:28,Put a bell on your bicycle: https://t.co/6HX7403OjJ https://t.co/CG7UGr1EfF
828667094652874753,2017-02-06 18:10:05,Don't let Pandora put you in a box. Stick to the thumbs-down button to get a better variety of music:… https://t.co/y6SN1czaBF
828659562894991360,2017-02-06 17:40:10,The easiest thing you can do isn't always the most pleasurable. Schedule your fun activities just like you do work:… https://t.co/P1grpQfd4I
828657085227352064,2017-02-06 17:30:19,How companies use your data even when you're not logged in: https://t.co/tuCn41jkd1 https://t.co/jnhCUg7Vlk
828651987499675648,2017-02-06 17:10:04,"Neil Cicierega, the guy behind Potter Puppet Pals, has some advice for young artists: Keep your old files.… https://t.co/bQEOc82yjI"
828649728762118145,2017-02-06 17:01:05,Use the five folder system to keep your emails organized and stay on top of the important ones:… https://t.co/7pSVFjn0EO
828649695362838532,2017-02-06 17:00:57,"RT @KinjaDeals: Anker's new smart scale, your favorite coffee maker, lumbar support, and the rest of Monday's best deals: https://t.co/uZ8Y…"
828634468235751425,2017-02-06 16:00:27,Just start dating someone? Here's how you should approach Valentine's Day when you're in a new relationship:… https://t.co/WgFUXXS961
828627784398405632,2017-02-06 15:33:53,RT @TwoCentsLH: Buying a home? Make sure you use the right mortgage calculator: https://t.co/5OFGkU0dif https://t.co/Vn2TSOuNTe
