id_str,created_at,text
1009509595046440960,2018-06-20 18:53:37,"Our GitHub Editor Tools team is always working to build the best experience—and to do that, want to hear from the p… https://t.co/7icxvAa6s0"
1009145046128570375,2018-06-19 18:45:02,There's one week left to join the GitHub Learning Lab Explorer Challenge! Complete the challenge by 11:59pm PT on J… https://t.co/bOXUWsnf4h
1009106118206001157,2018-06-19 16:10:21,"Starting today, schools can access our enterprise-level software and features for free by joining the new… https://t.co/DjHLmzPzZR"
1008877245895725058,2018-06-19 01:00:54,Announcing the release of GitHub for Unity 1.0 featuring the git workflow you love with support for Git LFS and fil… https://t.co/SywyXbs7sc
1007696362576728064,2018-06-15 18:48:29,GIFs on the command line? Our friends at Google have you covered: https://t.co/gxkWGPfP6v #GIFforCLI https://t.co/Ep2EcbyrG3
1007641074477817856,2018-06-15 15:08:47,"RT @kcpike: Think you could tweet about this job posting better than me? If so, apply to be @github's Social Media Marketing Manager:  http…"
1007307938883612674,2018-06-14 17:05:02,"It just got easier to work across GitHub right from your project boards. Click on a card to view, edit, react, and… https://t.co/6LveLfMskr"
1006984022445182978,2018-06-13 19:37:54,"RT @preetster: wired-elements (https://t.co/TmMBzfUjnI) has reached 5k stars on Github! 🎉🎊 ✨🎉On that note, anyone interested in contribu…"
1006929977042862080,2018-06-13 16:03:09,"#GitHubSatelliteTokyo Day Two wrapped up with talks on business development and how, no matter the industry, every… https://t.co/JubS20ybkm"
1006687641692180482,2018-06-13 00:00:11,We wrapped up #GitHubSatelliteTokyo Day One with a great reminder about contributing to the open source community:… https://t.co/rcP72KrZE8
1006657503395045378,2018-06-12 22:00:26,Spotted: Manga at #GitHubSatelliteTokyo! Speaker Ai Minatogawa uses it to teach those who are brand new to the Git… https://t.co/N8tzivx2n2
1006627611764805632,2018-06-12 20:01:39,Designer Hano Megumi didn't have a background in programming but that couldn't stop her from becoming a passionate… https://t.co/qVz8t29CMv
1006597211625607168,2018-06-12 18:00:51,"""The future will be more challenging than anything we can imagine, but more rewarding as well. We're here to delive… https://t.co/eb3BVO5vyu"
1006567087593189376,2018-06-12 16:01:09,Community was the focus of #GitHubSatelliteTokyo Day One. Speakers and attendees shared their favorite open source… https://t.co/RInFmxLHWV
1006530655000424450,2018-06-12 13:36:23,"The May Release Radar is out, featuring open source highlights from:🔵 Electron 2.0🔵 Rancher 2.0🔵 Mitmproxy 4.0a… https://t.co/PEwlUMmAV1"
1006363255185395713,2018-06-12 02:31:12,Starting now! Get all the live updates from #GitHubSatelliteTokyo today and tomorrow by following @GitHubJapan. We'… https://t.co/LIUcbVgjc5
1006265833293799425,2018-06-11 20:04:04,"RT @GitHubPolicy: Net neutrality rules are no longer in effect as of today, but the House can save #netneutrality. Tell your legislators to…"
1005147556979138563,2018-06-08 18:00:26,Can't watch the #NBAFinals tonight? Follow along in your terminal with https://t.co/2bRopuHgEQ https://t.co/TDCh3YaoYm
1005120816831295488,2018-06-08 16:14:11,On #WorldOceansDay we look at an unlikely couple—code and coral. See how @TheWCS is using software to help save our… https://t.co/HBno7kidIY
1005109455942451200,2018-06-08 15:29:02,"What started as the perfect design idea evolved into an opportunity to delve into contribution graphs, build an app… https://t.co/gYX8dIaqOC"
1005104100348977153,2018-06-08 15:07:46,"Last month, we introduced the GitHub Changelog. Subscribe to it now or follow @ghchangelog to read about updates as… https://t.co/08bZjJfTFD"
1004456284966522882,2018-06-06 20:13:34,"Happy Pride Month! Wear your ❤ on your sleeve with the limited-edition Pride and Trans Pride Shirts, available now… https://t.co/EIQfJNy2ip"
1004411846705721344,2018-06-06 17:16:59,It's never been easier to triage bugs and manage project tasks thanks to these new project board actions and templa… https://t.co/Vt7NNw4CeX
1003704579089788928,2018-06-04 18:26:34,A huge welcome to @natfriedman who will be joining the GitHub team as CEO. Hear more from him on today's announceme… https://t.co/LRY3xrU7tr
1003631063707496449,2018-06-04 13:34:26,RT @satyanadella: Microsoft + GitHub = Empowering Developers https://t.co/KqLacgODdk
1003627993321705472,2018-06-04 13:22:14,Hear more on today's announcement from our co-founder and CEO @defunkt https://t.co/VE01MCE8sy
1003626683889418240,2018-06-04 13:17:02,"RT @Microsoft: Microsoft to acquire @GitHub, the world’s leading software development platform. https://t.co/hAEN6bJcsg https://t.co/O5I0vT…"
1003623284829638659,2018-06-04 13:03:32,We're thrilled to announce that we've entered into an acquisition agreement with @Microsoft! https://t.co/4DezuXTJfV https://t.co/LUZxjXFVVw
1002214382376570886,2018-05-31 15:45:03,There's just one day left to submit a proposal to speak at this year's Universe. We can't wait to see you on stage!… https://t.co/kJsyQ8gEq1
1001953285799071745,2018-05-30 22:27:33,RT @reactathon: We're excited to announce that @GitHub is hosting us on September 8 for a special edition of Reactathon at their San Franci…
1001904848000966657,2018-05-30 19:15:04,"Need a Swiss Army knife for penetration testing, debugging, and testing web traffic that's free and open source?… https://t.co/pgJN2q6Lef"
1001869156369813504,2018-05-30 16:53:15,RT @HamelHusain: I am excited to share research my colleague Ho-Hsiang and I have done that uses deep learning to build semantic search on…
1001841584026062848,2018-05-30 15:03:41,The UN's free expression expert @davidakaye's report on content moderation and #FREEDEX is out! Read about the repo… https://t.co/jwzS2xMPak
1001507700117786626,2018-05-29 16:56:57,Enter our Community Forum challenge by sharing what you've learned with GitHub Learning Lab! https://t.co/FRurZqq4JH
1001478437188579328,2018-05-29 15:00:40,The new Privacy Statement and Terms of Service are in effect. Thank you to everyone who sent us feedback in our Sit… https://t.co/wYY306Vr0K
1000068242545704963,2018-05-25 17:37:04,"RT @GHchangelog: You can now request an archive of your repository, issue, comment, and other GitHub data in a single file. Learn how now.…"
999775814693670912,2018-05-24 22:15:03,"At this year's Universe we're looking ahead, at the future of software—and we want to hear how you're turning ideas… https://t.co/kcgsHXxKOG"
999743068604653568,2018-05-24 20:04:56,RT @pranaygp: I love the constant stream of new features @github keeps adding that (at least to me) are exactly what I wanted but never kne…
999727771575357441,2018-05-24 19:04:09,Need an extra reason to get in on our biggest conference of the year? Our Memorial Day sale starts now—use code EXT… https://t.co/6we8Dc0d8g
999706528373493766,2018-05-24 17:39:44,"We just released an updated search bar which means finding your favorite and most recent teams, repositories and pr… https://t.co/HWtuW6TYyd"
999339120219557889,2018-05-23 17:19:47,How can tech companies protect human rights? See what we learned and spoke about at @rightscon last week. https://t.co/kHehKNaCvV
999254908468715520,2018-05-23 11:45:10,"Congratulations, @tensorflow! With projects like this, it's no wonder you reached 100K stars.… https://t.co/LMz4inNYqg"
999048120796409856,2018-05-22 22:03:28,"We just released GitHub Desktop 1.2! Stay up to date with your coworkers' changes, compare and merge any branch wit… https://t.co/cWp9NkCPEY"
998980909171961856,2018-05-22 17:36:23,"One year is just the beginning, and we can’t wait to see what you build next. Check out the newest apps on Marketpl… https://t.co/guOJm4JhHW"
997217203165499392,2018-05-17 20:48:03,"RT @GHchangelog: Navigate back to recent projects and other activities directly from your dashboards, find ranked repositories in the sideb…"
997162801046151169,2018-05-17 17:11:52,"Take action on pull requests, issues, and more right from your Slack channels to start moving work forward, faster. https://t.co/JXfLebVKOe"
996853832721321986,2018-05-16 20:44:09,We cherry-picked some great games from the latest @ludumdare competition that you can play or hack on:… https://t.co/tEV7OC4aMy
996103116905951233,2018-05-14 19:01:04,"RT @GitHubPolicy: The U.S. Senate will vote on restoring #NetNeutrality this Wednesday, May 16th. Tell your legislators to support a level…"
994269507563769856,2018-05-09 17:34:57,RT @GitHubPolicy: The U.S. Senate will vote on restoring #NetNeutrality soon. Tell your legislators to support a level playing field for al…
994218526754922498,2018-05-09 14:12:23,The April Release Radar is out highlighting... 🔘Flask 1.0🔘Hyper 2.0🔘Handsontable 2.0🔘NetHack 3.6.1... and mu… https://t.co/tGrznYmyWg
993890870641520640,2018-05-08 16:30:23,Comment on issues and more right from your @Outlook inbox. Learn more about the new GitHub integration with Outlook… https://t.co/DF5v13nPWA
993553803701112832,2018-05-07 18:11:00,RT @VSAppCenter: Exciting news! We’re introducing a #VSAppCenter + @GitHub integration that offers you #ContinuousIntegration (CI) and #Con…
993531068581064705,2018-05-07 16:40:40,https://t.co/hLKebAwQb3
993520419452973057,2018-05-07 15:58:21,"With the new Checks API, your integrations can report statuses with more context, annotate code with details, and m… https://t.co/FmmyKsinCc"
992399697921888256,2018-05-04 13:45:00,RT @GitHubCommunity: We’re excited to kick off Day 1 of #Codeland! Stop by our table to talk about GitHub #ImpactoCats and to pick up stick…
992102742155030528,2018-05-03 18:05:00,https://t.co/8drx0bEUS7
992095639382077440,2018-05-03 17:36:47,"We've launched @GHchangelog, a new place to find out about all GitHub features, updates, and improvements.… https://t.co/VcIxDDEyqx"
991795313802440705,2018-05-02 21:43:24,RT @sallar: Hi 👋I made a simple tool to generate an image of all your Github contributions! So you can tweet it ✨Check it out here: htt…
991726037422702592,2018-05-02 17:08:07,"GitHub Desktop is cross-platform, customizable, and community-supported. See more reasons to try out the latest ver… https://t.co/et9pGccXUQ"
991695398522773504,2018-05-02 15:06:22,RT @travisci: ✨Starting today you can test and deploy open source and private projects on https://t.co/Wbay06jXcD. ✨ https://t.co/rYG1QxEhh…
991573083264901120,2018-05-02 07:00:20,There is still time to help policymakers effectively protect software development in the EU and it’s important for… https://t.co/ZLumFJwPcZ
991417034973089792,2018-05-01 20:40:15,Starting a new project is a lot easier if you can do things the same way you did before. You can now quickly reprod… https://t.co/1AS8tBBtJk
991366832421523456,2018-05-01 17:20:46,"Today, custom domains on GitHub Pages are gaining support for HTTPS via @letsencrypt. It's another step towards mak… https://t.co/Xb4MSiGi8K"
991331736142467073,2018-05-01 15:01:18,"The early bird catches the Universe worm, get your half-price tickets for $299 for a limited time only. https://t.co/9gQRFt3aqQ"
988873462738546688,2018-04-24 20:13:00,GitHub contributions by financial organizations have increased by 40% in the past year. We've joined… https://t.co/HxDqQeWrbV
988543788082577409,2018-04-23 22:22:59,RT @GitHubPolicy: About 30 legislative days remain for Congress to restore the FCC open internet order protecting #netneutrality. Call Cong…
988181735832604672,2018-04-22 22:24:20,"Congratulations on 1 million users Sam!For those that haven't come across Sonic Pi yet, we think it'll be music t… https://t.co/0H8txeCzK8"
987766704817123328,2018-04-21 18:55:08,Create some pixel art or animated sprites with these tools in our latest collection: https://t.co/AQDQP3gDMc https://t.co/ENkkfaLGGj
987464085506846722,2018-04-20 22:52:38,We’ve made a few clarifications and changes to our Privacy Statement and Terms of Service in anticipation of Europe… https://t.co/j0sasXDM70
987441113131769858,2018-04-20 21:21:21,Congratulations to the @zeithq team and community on shipping Hyper 2.0 plus a new plugin and theme store!… https://t.co/16KrFIj8h2
987006715194478593,2018-04-19 16:35:13,Level up your GitHub skills with the help of GitHub Learning Lab—a series of hands-on courses you can complete righ… https://t.co/ncrZeAOAPF
986997977540591617,2018-04-19 16:00:30,Join us for our two-day event celebrating the best developer community in the known universe. Pick up tickets for j… https://t.co/tp7UIltw2e
986325515505201152,2018-04-17 19:28:22,"March flew by, but you shipped a lot of releases! Here are the ones that hit our radar: https://t.co/pPpKBOdFPn"
986244361062150145,2018-04-17 14:05:53,We're joining technology companies around the world to make the internet safer and more resilient. Learn more about… https://t.co/LLa1xhMArg
984882509656702976,2018-04-13 19:54:23,RT @jonrohan: I wrote an in depth article about how the GitHub Design Systems team is using the @figmadesign API in our workflow 🙌🏻 ⚡️ http…
984788686989676544,2018-04-13 13:41:34,"RT @DevXCon: Welcoming Brian Douglas, Developer Advocate at @github as a speaker at #DevXcon 2018!Join us in San Francisco on June 4/5 fo…"
984595793859366912,2018-04-13 00:55:04,"Thank you @Bitbucket, but the cake has disappeared. Please send more. https://t.co/Pnd326bxjj"
984452702368358402,2018-04-12 15:26:29,RT @GitHubEducation: The winner of the @GitHubEducation #MyOctocat contest for #sunhacks is @cyndoodle104 for https://t.co/AbTfNok4H7 https…
984199992213692416,2018-04-11 22:42:18,RT @VSTS: Share the ❤…  A big Happy Birthday to our friends at #GitHub. https://t.co/clYEkYeU1w
984193012388556800,2018-04-11 22:14:34,@erhannah You have to start somewhere! I bet your code is awesome. https://t.co/3DmsufJH4N
984191463763402752,2018-04-11 22:08:25,@simpsoka  https://t.co/sCkWQQEsb7
984185208000917504,2018-04-11 21:43:33,RT @dhh: Congratulations to @github on the 10-year anniversary ❤️🎉. Open source development got so much nicer with Git and GitHub in the wo…
984180644824666112,2018-04-11 21:25:25,"Thank you for the code you’ve committed, the pull requests you’ve merged, and the 10 years of GitHub you’ve made po… https://t.co/475YcZjurz"
984169990113787904,2018-04-11 20:43:05,@ironymark @unicode Thank you for responding @ironymark. We should have gotten those translations right regardless. We've updated the video.
984161222298759168,2018-04-11 20:08:14,"@tha_rami Hi @tha_rami, we shouldn’t have gotten that wrong. We’ve updated the translation in the video."
984158958259597312,2018-04-11 19:59:15,@Sas_Amir Thank you for your response! We shouldn’t have gotten that wrong. We’ve updated the video with the correct translation.
984158149337739264,2018-04-11 19:56:02,@CarmenMarced @maishsk Thank you for catching that! We’ve updated the video with the correct translation.
983930389365485568,2018-04-11 04:51:00,@NutPandaDotCom  https://t.co/v7SPhsZTEL
983929558125744128,2018-04-11 04:47:41,RT @paulredmond: This screenshot of @github (via Internet Archive) back in 2009 is wild  😍Happy 10 years GitHub! https://t.co/9Ea5TnxJb1
983920463008104449,2018-04-11 04:11:33,"@VSTS Thank you, friend. Here's to many more!"
983920183134867456,2018-04-11 04:10:26,@jessfraz thank you! 😍
983919921573842944,2018-04-11 04:09:24,RT @tammybutow: Happy 10 years @github - I joined in November 2009 : ) https://t.co/40pL4IqGcS https://t.co/fPZog1aNxY
983793479364038664,2018-04-10 19:46:58,RT @tweetsbyelliot: Celebrating 10 years of GitHub with Mona Octocat cake pops! Happy birthday @GitHub! https://t.co/z9THgKPCwz
983754628348116992,2018-04-10 17:12:35,"To celebrate 10 years, we’ve collected some our favorite moments and milestones—just a few ways you’ve pushed softw… https://t.co/60msXCmmaz"
982287022998958082,2018-04-06 16:00:50,RT @spolsky: It's been about ten years since @codinghorror and I started building @StackOverflow so I decided to write a series of blog pos…
982046947036073990,2018-04-06 00:06:52,"Here's our look at a few highlights of Git 2.15, 2.16, and 2.17. https://t.co/V6uy1eLVt4"
979137708642721792,2018-03-28 23:26:35,"There are a few new permission options for your organization's projects. Work with your team in new ways, expand wh… https://t.co/NgnnzAAHge"
978699453484945408,2018-03-27 18:25:07,"New tools to collaborate with your team, build custom apps, and more—get it all with our latest GitHub Enterprise r… https://t.co/EtzyoDOqsM"
977281454240600064,2018-03-23 20:30:30,Now you can version larger files without leaving Unity. Our beta release includes support for Git LFS and file lock… https://t.co/T7WFkYFl7M
976592018356035585,2018-03-21 22:50:56,Hover over another user’s avatar to learn a little more about who you’re working with. You'll see their profile inf… https://t.co/DfiGfhaymf
976528762828476416,2018-03-21 18:39:34,Our Data Team looked at how many vulnerabilities you've responded to (and how quickly you resolved them) since secu… https://t.co/c9PK2KFwYv
975812643683553280,2018-03-19 19:13:58,Mark your calendars! GitHub Universe returns October 16-17 to the Palace of Fine Arts in San Francisco 📆🖊 https://t.co/pStw1pgVFT
974743807680901120,2018-03-16 20:26:48,"RT @AtomEditor: Atom 1.25 and 1.26 beta are out, bringing new GitHub package features as well as experimental improvements in syntax highli…"
974743587400364032,2018-03-16 20:25:55,What makes a Git repository unwieldy to work with or host? git-sizer measures size-related properties of your repos… https://t.co/eEcA5U3vUk
974337361013125120,2018-03-15 17:31:43,RT @GitHubPolicy: Developers: EU policymakers need to know why upload filters for code will break builds and make software ecosystems more…
973960834618724352,2018-03-14 16:35:32,"Thank you for helping make GitHub more secure! To celebrate four years of our Bug Bounty program, we're sharing som… https://t.co/bNlmXcpoZb"
973315040211357696,2018-03-12 21:49:23,"In town for GDC? Stop by GitHub HQ for a night of talks, demos, and conversation with @reduzio and @moonscript at t… https://t.co/8vb8dJvnoy"
972967508419497985,2018-03-11 22:48:25,"Will you be in San Francisco for #GDC18 next week? You're invited to our annual GDC Party at GitHub HQ on Tuesday,… https://t.co/cwtD6PgrGA"
972312596421529601,2018-03-10 03:26:02,"Join us on Sunday, March 18, for the third annual International Conference on Game Jams, Hackathons, and Game Creat… https://t.co/O6uEwDOUYz"
972215051099803648,2018-03-09 20:58:25,"February may be the shortest month, but it certainly wasn't short on new releases! Here are a few projects that cau… https://t.co/lBF9SYbRbj"
971840995540242437,2018-03-08 20:12:03,Today we're celebrating International Women's Day at our Women’s Leadership Summit in New York City. Thanks to all… https://t.co/c1K7r5AlCO
971657030523072513,2018-03-08 08:01:03,"Tune in to today's #gitmerge keynotes and talks, starting soon—live from Barcelona! https://t.co/GyZotnotdw"
970863498799525889,2018-03-06 03:27:50,"A new Git LFS release is out with a rewrite of the pattern matching engine, an enhanced API, standardized progress… https://t.co/yAayWScE9b"
969689242266877952,2018-03-02 21:41:45,Record your terminal sessions with @asciinema and replay them in a terminal or web browser: https://t.co/1t34kngLzH https://t.co/gQ5UhpjgVK
968608292166488064,2018-02-27 22:06:27,"RT @simona_cotin: I LOVE how friendly the @nodejs project is to new contributors. Look at those labels 'good first issue', 'mentor-availabl…"
968536070898855936,2018-02-27 17:19:28,"RT @SlackHQ: We’ve partnered with @GitHub to give teams even more clarity on project status, right in Slack. And we’ve only just begun. htt…"
968456935308742657,2018-02-27 12:05:01,"The U.S. Congress now has 60 legislative days to reverse the FCC’s order, starting in the Senate. To protect… https://t.co/pVy3tnXcEH"
968283316280438785,2018-02-27 00:35:07,"Now PHP developers can quickly navigate to changed methods and functions in their pull requests, too.… https://t.co/3xW6WdjopI"
968252567636475904,2018-02-26 22:32:56,We released GitHub Desktop 1.1 to make it even easier to interact with pull requests in the app. Check out the loca… https://t.co/PAV4BFvjhZ
968184708583522304,2018-02-26 18:03:17,Invite your code to the conversation with the new GitHub and Slack app. https://t.co/Vg9xCf1YBb
968169976732536832,2018-02-26 17:04:44,"Teachers, we've launched a new online training built just for you. Learn how to commit with confidence and start te… https://t.co/XUIyQYtUrx"
966746441514274816,2018-02-22 18:48:07,"The Community Forum is a place to ask questions, share ideas, and get updates from the GitHub Team. Not sure where… https://t.co/9qKJYhN0KV"
966737319397961728,2018-02-22 18:11:52,RT @GitHubPolicy: GitHub recently partnered with @_Ingressive_ to experience Nigeria's growing tech sector. Here's what we learned and why…
966467599566389248,2018-02-22 00:20:06,Labels just got a lot more meaningful with ✨emoji✨ and descriptions. https://t.co/5OR11lCMXf https://t.co/BGC6soEI6S
965313918741573632,2018-02-18 19:55:47,"Nicely shipped, @photonstorm! 🎉 https://t.co/AHhKNdatU3"
963877992307998720,2018-02-14 20:49:56,"RT @mdo: Over a year and half later, here's that blog post on how we shipped system fonts to https://t.co/eRIXyoa8Qa. Better late (and stil…"
963876315849023490,2018-02-14 20:43:16,We've joined 49 companies in filing an amicus brief that protects sanctuary cities. We believe in creating inclusiv… https://t.co/bSyh1Y6paV
963821054807478272,2018-02-14 17:03:41,"From tougher security to more beautiful source code images, check out the releases that have delighting and deliver… https://t.co/cKz3D1S3oL"
963227379911966721,2018-02-13 01:44:37,There's a new way to share feedback on https://t.co/rTBCzQBIpO through GitHub issues. https://t.co/pCqO6LDo7i https://t.co/QQ8n5x5sN5
961684628137529344,2018-02-08 19:34:17,"With 2018 underway, GitHub’s Data Science Team looked at the growth of contributors, visits, and stars across some… https://t.co/nqKAywMSAI"
961666013954740224,2018-02-08 18:20:19,"If you’re exploring #SaaStrAnnual2018 today, check out the Fireside Stage at noon PT to hear our Chief Strategy Off… https://t.co/LwZWeMItjy"
960194836149125120,2018-02-04 16:54:23,"Query your Linux, macOS, and Windows infrastructure like a database with osquery: https://t.co/8w5O3hyTbN. Great fo… https://t.co/rLx0e2m6Wt"
959819913803137025,2018-02-03 16:04:34,Looking to show off some code samples in a presentation or tweet? Make your code beautiful with this neat app from… https://t.co/rl2IpbCchc
959139135725457409,2018-02-01 18:59:24,Looking for a contribution for #opensourcefriday? Topic pages help people learn about everything from Tensorflow to… https://t.co/7CXUP6z32L
958135523721302016,2018-01-30 00:31:24,"Whether you’re pairing or working with your entire team on a commit, now you can see everyone who contributed with… https://t.co/uWEWOOkJ0w"
958123791938277376,2018-01-29 23:44:47,"RT @reduzio: After a year and half of tireless work by our dedicated developer community, the new version of Godot, 3.0 is finally here! En…"
958093919375405057,2018-01-29 21:46:05,RT @niik: Couldn't be more happy for the launch of commit co-authors in GitHub and GitHub Desktop today. Pair away and share that commit at…
956671499041234944,2018-01-25 23:33:54,Sometimes one template just isn't enough. https://t.co/Fn9DZurA6b
955947749806977025,2018-01-23 23:37:58,"Now there's an easier way to report comments, issues, pull requests, and commit comments to GitHub Support. https://t.co/0jiSChs6bA"
955903060651290624,2018-01-23 20:40:24,"RT @fbOpenSource: Introducing Detectron, Facebook AI Research's platform for object detection research, powered by @caffe2ai. https://t.co/…"
954467266434945024,2018-01-19 21:35:04,Parts of GitHub might look a little different today. We've changed the text color for issue labels to meet accessib… https://t.co/qjrnG2aEjM
954390604674342912,2018-01-19 16:30:26,RT @mitchellh: It has been 8 years (on Sunday) since I pushed the first commit to Vagrant. Vagrant has grown to something more than I ever…
951885678312415235,2018-01-12 18:36:45,"PowerShell Core 6.0.0 is now available for Windows, macOS, and Linux. Congrats @powershell_team and community!… https://t.co/c3TRRPEGgB"
950425915409993733,2018-01-08 17:56:10,There are so many resources out there to help you learn GitHub. We'll walk you through a few of our favorites on Ja… https://t.co/jOZ3Js6iUD
949378239973265409,2018-01-05 20:33:05,Now you can connect GitHub Enterprise with @codeship. Learn more about the new integration. https://t.co/5DVWRmL2tW
949080423631433733,2018-01-05 00:49:40,"RT @GitHubPolicy: The FCC did not leave its order to roll back #netneutrality rules in 2017. Today, it released its Final Order. Check out…"
948982442400059392,2018-01-04 18:20:20,New progress bars help you track projects across GitHub from your project boards. https://t.co/sU5O9anJ4X https://t.co/ALph19byNk
948970608066351104,2018-01-04 17:33:18,RT @appcanary: We're super excited to announce that we're joining GitHub to bring security to the masses!Appcanary the product will conti…
945352880877314048,2017-12-25 17:57:45,"RT @24PullRequests: Happy Holidays! 🎅This year 3,708 developers submitted 22,671 pull requests to 9,195 different open source projects.…"
944994332330749952,2017-12-24 18:13:00,Glitcher from @muifwego is a tactical espionage game where you play as a computer virus infiltrating an operating s… https://t.co/h9qMF3GtqK
