id_str,created_at,text
944869347956162560,2017-12-24 09:56:22,Congratulations to our overall #GitHubGameOff winner Daemon vs. Demon from @securas2010. Built using @godotengine a… https://t.co/GgReyZ8J7r
944705841097093120,2017-12-23 23:06:38,In COMMIT4 from @balajmarius the bug invaders are coming to destroy the master branch: https://t.co/8lCodvcu22. Mad… https://t.co/2kDA9vZ7IS
944662907379376128,2017-12-23 20:16:02,Fly through a procedurally generated world in @Zaphyk's Neon Skylines: https://t.co/xmEcgJeP3d #GitHubGameOff… https://t.co/SUJSWXvTS0
944605497180635136,2017-12-23 16:27:55,Thank you everyone who took part in this year's Game Off. Special thanks to our friends at @itchio for helping make… https://t.co/M9lv4NJSBZ
944324471103426560,2017-12-22 21:51:13,"You submitted over 200 incredible games for the #GitHubGameOff! Here are the winners, picked by the developers them… https://t.co/KVn3xBh2fc"
943904489412710400,2017-12-21 18:02:21,"From technology populism to open source in the public sector, GitHub’s Chief Strategy Officer Julio Avalos shares h… https://t.co/UlAPZH3JIr"
943775556398649344,2017-12-21 09:30:01,Want to give a talk at Git Merge in Barcelona? If you're a first time speaker or feel like your voice isn't often h… https://t.co/r8M54zywDN
943640019041796096,2017-12-21 00:31:27,RT @alysonlaaa: Its been a pretty wonderful 5 years @github. I wrote this article to hopefully help others on their coding journey https://…
943226286910054400,2017-12-19 21:07:25,"RT @GitHubEducation: 👀 Using GitHub to build @CS50, @Harvard University's largest course and @edXOnline's largest MOOC -- a talk by @DavidJ…"
941753084476194816,2017-12-15 19:33:26,"The FCC vote on #NetNeutrality is over, but the fight continues. We stand with the builders and innovators in our c… https://t.co/wfCi8p31Ht"
941323135630032896,2017-12-14 15:04:59,RT @GitHubPolicy: The #FCC's vote on rolling back #NetNeutrality rules is today. It’s not over till it’s over. Continue to make your voice…
941116492803747840,2017-12-14 01:23:51,"RT @AtomEditor: Teletype 0.4.0 is out! You can now share and edit multiple files during your real-time coding sessions, and collaborators c…"
940716832897556481,2017-12-12 22:55:45,#NetNeutrality affects everyone—and we’ve only got two more days to let Congress know how we feel. Join the fight f… https://t.co/n3uKbHYENJ
940678232927432704,2017-12-12 20:22:22,"RT @timberners_lee: #NetNeutrality allowed me to invent the web. If protections are scrapped, innovators will have to ask ISPs for permissi…"
940675733994856450,2017-12-12 20:12:26,"Get project board automation, global webhooks, and more ways to keep work organized with Enterprise 2.12:… https://t.co/QaP2dNPBVD"
940506522613895168,2017-12-12 09:00:03,"This year, Git Merge is headed to Spain! Grab a ticket or submit a talk today 🇪🇸 https://t.co/epNqZTlc4W"
940368481559515136,2017-12-11 23:51:31,"RT @getsentry: 🎄  On this third (business) day of integrations, we look at just how wonderful life can be when you connect Sentry and @gith…"
940234741428703232,2017-12-11 15:00:05,"Last week, we announced our work with @pivotal to bring GitHub Enterprise to @pivotalcf. Learn more from our SVP of… https://t.co/HP6Eydqp9d"
939650449195409409,2017-12-10 00:18:19,"It’s Grace Hopper’s birthday! To celebrate, listen to @RedRoxProjects share her experience growing a community for… https://t.co/U7LLQn9eqS"
938936016647409664,2017-12-08 00:59:25,RT @GitHubEng: If you are at #kubecon2017 be sure to check out @jnewland’s keynote about #kubernetes at GitHub https://t.co/zStBCTW1ft
938859740574208001,2017-12-07 19:56:19,See what’s new in Marketplace this month: https://t.co/D1I1AlSGMa https://t.co/t3qSUTqXP6
938764062883753984,2017-12-07 13:36:08,"RT @notdetails: Ever get confused between your ""base"" and ""compare"" branches? Shipped a tiny @github change today that will hopefully clear…"
938470273115967488,2017-12-06 18:08:43,"From the rise of data to #netneutrality, SVP Technology @jasoncwarner shares his predictions for tech in 2018. https://t.co/yTfD15X0hV"
938413622589624320,2017-12-06 14:23:37,"The @NHM_London has to deal with a lot of bugs—about 33 million of them—so they built Inselect, an open source tool… https://t.co/bEXriccWda"
938409149863550977,2017-12-06 14:05:50,RT @githubuniverse: Couldn't make it to #githubuniverse? Watch recordings from all sessions and keynotes—now on YouTube! https://t.co/Rp75c…
938098200535293953,2017-12-05 17:30:14,Here we go again... the @FCC is set to vote on new #netneutrality rules December 14. See how you can join us in sup… https://t.co/4Ou5iwjRXA
938076468814450690,2017-12-05 16:03:53,RT @timberners_lee: Github also calls for New Neutrality https://t.co/MQqM6NeeMF -- really important to make your voice heard.
937860103621042182,2017-12-05 01:44:07,The fight for an open internet isn’t over—and we need your help now more than ever. Join us in support of… https://t.co/S0HkuQ9lmr
937400315007176710,2017-12-03 19:17:05,RT @djangoproject: Django 2.0 released https://t.co/A0kqNqu4QG
936379112029065216,2017-11-30 23:39:12,"32,000 people. 200,000 pull requests. See how you made this year’s Hacktoberfest our biggest yet: https://t.co/oKQPcZjQv8"
935965231850905600,2017-11-29 20:14:35,"This December, join @24PullRequests and contribute your bug fixes, documentation, and more to the open source proje… https://t.co/EYho3QWr9p"
935633574539251717,2017-11-28 22:16:42,Learn how to set up your own instance of GitHub Enterprise with Solutions Engineer @_tcbyrd. https://t.co/ukPFIOBGaW
934210064470233088,2017-11-25 00:00:10,"It's that time of year again! Save 30% on all orders in the GitHub Shop when you use GHSALE2017 at checkout, now un… https://t.co/Gpiu0wMwzG"
934122966060797958,2017-11-24 18:14:04,Meet your new robot sidekick. https://t.co/C1zMYiDObb https://t.co/MdidDXGDiK
933092167081275394,2017-11-21 21:58:03,Congrats to our friends @Jibo on the @TIMEMagUSA cover! Learn more about how they built the world's first social ro… https://t.co/IqmwVZ58NG
933002115798224896,2017-11-21 16:00:13,"Your first open source contribution can be daunting. Here's a little help getting started from @kytrinyx, maintaine… https://t.co/sDEFFIw98R"
932700150174281730,2017-11-20 20:00:19,Guess who's rocketing into the GitHub Shop this Friday—just in time for our Cyber Week sale. https://t.co/FjEP3fTVe6
932670609208889344,2017-11-20 18:02:56,Why comment when you can discuss? Now there's more space to talk through your projects with team discussions.… https://t.co/7PWT9DwvCF
931620930777882625,2017-11-17 20:31:53,There are still two weeks (and two whole weekends) left to participate in the #GitHubGameOff:… https://t.co/x40rEDTrCI
931566609998712832,2017-11-17 16:56:02,Students at Aoyama Gakuin University in Japan help solve crises as they learn to code. https://t.co/gGvq2o2hl3
931220404840075264,2017-11-16 18:00:20,Now GitHub can help you find and fix vulnerabilities in your dependencies. Just enable your dependency graph to sta… https://t.co/cFv9EGydXI
931188941016854528,2017-11-16 15:55:18,RT @codefresh: We're excited to join the @github marketplace. Using Codefresh for continuous delivery just got easier! https://t.co/KzDdZ2o…
931175095560757249,2017-11-16 15:00:17,Get ready! We're connecting the Git Virtual File System to GitHub with @Microsoft #MSFTConnect… https://t.co/2KIDnvw46V
930833442702548993,2017-11-15 16:22:41,Work together on the same code at the same time with Teletype for Atom. https://t.co/hEeRmslC2T https://t.co/rOJLkSivSw
930812664535834625,2017-11-15 15:00:07,Tune in at 3 pm ET: GitHub’s @isamlambert will be talking about our open source partnership on stage live with… https://t.co/gD0tQKSrtC
930583265286721536,2017-11-14 23:48:34,"Deploy, review, and localize your projects with the help of four new Marketplace apps. https://t.co/WvdA0cmDd1"
928675264871174145,2017-11-09 17:26:51,"Replay user behavior, reproduce bugs, and fix issues fast with LogRocket—now in Marketplace! https://t.co/w61eU4jsnZ https://t.co/YPLtN9TblW"
928629933265575936,2017-11-09 14:26:43,"Here's a throwback to last year's #GitHubGameOff on hacking, modding, and augmenting. There's still time to join th… https://t.co/kWvMx1HSsL"
928394720144916480,2017-11-08 22:52:04,Ready to get started with CI? Teams on GitHub are using dozens of CI tools to ship better code.… https://t.co/1aVVDV2waW
928319445633765376,2017-11-08 17:52:57,Sometimes a project is worth saving—even if you don't work on it anymore. Now you can archive repos as read-only!… https://t.co/hny17rJQP4
